{
  "schema_version": 1,
  "meta": {
    "generated_by": "migration/migrate.js",
    "legacy_source": "analysis.html",
    "legacy_commit": "02e5167",
    "as_of": "2026-09-26T21:00:00+09:00",
    "status": "active",
    "note": "④ PRO EDGE：新設の独立分析系統。旧RMCに対応するデータは無いため空。候補は④自身の探索回（pe-…）で独立に追加する。"
  },
  "system": "pro_edge",
  "discovery_runs": [
    {
      "run_id": "pe-20260926-live-trial",
      "started_at": "2026-09-26T21:00:00+09:00",
      "slot": "adhoc",
      "note": "本番即時試走。PRO EDGEとして独立探索。実市場オッズは取得したが、no-vig市場確率に対する独立base_probabilityを十分な根拠で固定できないため新規accepted/watchなし。市場確率のコピーは禁止。"
    },
    {
      "run_id": "pe-20260926-2258",
      "started_at": "2026-09-26T22:58:00+09:00",
      "slot": "adhoc",
      "note": "独立探索。実オッズ（例 Rublev 1.25前後、Shapovalov 1.36-1.39前後、Alcaraz 1.28前後）を確認したが、独立base_probabilityを十分な根拠で固定できないためaccepted/watchなし。市場確率をbaseへコピーしない。"
    },
    {
      "run_id": "pe-fulltrial-20260926-2254c",
      "started_at": "2026-09-26T22:54:00+09:00",
      "slot": "adhoc",
      "note": "独立PRO EDGE探索。Mannarino/Shapovalov市場2.84/1.42のno-vig Shapovalov確率は約66.67%。独立ベースは72-75%方向だが、1.42で中心73.5%ならEV約4.37%。ただしPRO EDGE専用の再現可能なbase model入力一式と複数book consensusをこの回で固定できないためaccepted/watch登録は見送り。市場確率をbaseへコピーしていない。"
    },
    {
      "run_id": "pe-wide-20260926-2359",
      "started_at": "2026-09-26T23:59:00+09:00",
      "slot": "adhoc",
      "note": "Independent full-category price scan. No accepted/watch card because multiple-book no-vig market snapshot plus reproducible independent base model was not simultaneously available for a new card. Market probability was not copied into base probability. No logic changes."
    },
    {
      "run_id": "pe-complete-20260927-0003",
      "started_at": "2026-09-27T00:03:00+09:00",
      "slot": "adhoc",
      "note": "Independent full-category scan. No new accepted card without simultaneous reproducible independent base model and verifiable multi-book market snapshot. Market probability not copied to base probability."
    },
    {
      "run_id": "pe-coverage-gate-20260927-0021",
      "started_at": "2026-09-27T00:21:00+09:00",
      "slot": "23:00",
      "note": "mechanism test"
    },
    {
      "run_id": "pe-rmc-20260927-bc-202609271444",
      "started_at": "2026-09-27T14:44:07.844+09:00",
      "slot": "12:00",
      "note": "BET CHANNEL最新screening_event_ids 186件をpro_edgeロジックで独立全件一次走査。共通候補プール不使用。"
    },
    {
      "run_id": "pe-rmc-20260927-bc-202609271509-marketcheck",
      "started_at": "2026-09-27T15:09:30+09:00",
      "slot": "12:00",
      "note": "BET CHANNEL screening_event_ids 186件を独立再走査。外部市場クロスチェック追加後の完全再監査。"
    },
    {
      "run_id": "pe-manual-full-v3-20260927-2126",
      "started_at": "2026-09-27T21:26:30+09:00",
      "slot": "adhoc",
      "note": "最新JSTインベントリ全件を独立一次走査。"
    },
    {
      "run_id": "pe-live-coverage-202609282322-3c55df",
      "started_at": "2026-09-28T23:22:14.042+09:00",
      "slot": "adhoc",
      "note": "BET CHANNEL complete union（通常+fixed-odds/eSports）全eventを使うライブcoverage dry-run。候補の最終採否・本番pick追加は行わない。"
    }
  ],
  "picks": [
    {
      "id": "pe-202609271444-seahawks",
      "system": "pro_edge",
      "match_id": "2026-09-28-commanders-seahawks",
      "run_id": "pe-rmc-20260927-bc-202609271444",
      "analysis_id": "pe-an-202609271444-seahawks",
      "market": "match_1x2",
      "selection": "side_b",
      "selection_label": "シーホークス",
      "discovered_at": "2026-09-27T14:44:07.844+09:00",
      "locked_at": "2026-09-27T14:44:07.844+09:00",
      "bet_at": null,
      "live": false,
      "price_snapshots": [
        {
          "snapshot_id": "ps-bc-220230-202609271444",
          "kind": "analysis",
          "bookmaker": "BET CHANNEL",
          "market": "match_1x2",
          "outcomes": {
            "side_a": 3.97,
            "side_b": 1.29,
            "draw": 30.44
          },
          "observed_at": "2026-09-27T14:33:16.617+09:00",
          "source": "BET CHANNEL event 220230"
        }
      ],
      "bet_odds": null,
      "bet_bookmaker": null,
      "stake": null,
      "locked": {
        "decision": "watch",
        "decision_reason": "計算EVは3%基準を上回るが、2026序盤2試合のみで独立モデルの校正サンプルが不足するため監視。",
        "required_ev": 0.03,
        "market_reference": {
          "snapshot_ids": [
            "ps-bc-220230-202609271444"
          ],
          "method": "single_book"
        },
        "offered_price": {
          "snapshot_id": "ps-bc-220230-202609271444"
        },
        "model": {
          "model_id": "rmc-nfl-rating-logistic",
          "model_version": "0.1",
          "sport_module": "other",
          "method": "rating_logistic",
          "trained_through": "2026-09-26T23:59:00+09:00"
        },
        "base_probability": 0.782,
        "expert_adjustments": [
          {
            "adjustment_value": 0.033,
            "category": "absence",
            "reason": "Washington starting QB Jayden Daniels OUT; Marcus Mariota starts",
            "source": "https://www.nfl.com/news/marcus-mariota-commanders-week-3-qb-jayden-daniels-elbow",
            "created_at": "2026-09-27T14:44:07.844+09:00"
          },
          {
            "adjustment_value": -0.01,
            "category": "absence",
            "reason": "Seattle starting safeties Julian Love and Ty Okada OUT",
            "source": "https://www.seahawks.com/news/week-3-injury-report-seahawks-vs-commanders",
            "created_at": "2026-09-27T14:44:07.844+09:00"
          }
        ],
        "features": [
          {
            "name": "recent6_record",
            "status": "present",
            "value": {
              "seattle": "2-0",
              "washington": "0-2"
            },
            "observed_at": "2026-09-27T14:44:07.844+09:00",
            "source": "https://www.seahawks.com/news/week-3-injury-report-seahawks-vs-commanders",
            "note": "2026 Week 2終了時点のスタート"
          },
          {
            "name": "lineup_today",
            "status": "present",
            "value": {
              "seattle_qb": "Sam Darnold ready",
              "washington_qb": "Marcus Mariota start"
            },
            "observed_at": "2026-09-27T14:44:07.844+09:00",
            "source": "https://www.seahawks.com/news/week-3-injury-report-seahawks-vs-commanders",
            "note": null
          },
          {
            "name": "absences",
            "status": "present",
            "value": {
              "seattle": [
                "Julian Love",
                "Ty Okada"
              ],
              "washington": [
                "Jayden Daniels",
                "Sam Cosmi",
                "Nick Cross",
                "Frankie Luvu",
                "Chigoziem Okonkwo"
              ]
            },
            "observed_at": "2026-09-27T14:44:07.844+09:00",
            "source": "https://www.seahawks.com/news/week-3-injury-report-seahawks-vs-commanders",
            "note": null
          },
          {
            "name": "venue_role",
            "status": "present",
            "value": "Washington home / Seattle away",
            "observed_at": "2026-09-27T14:44:07.844+09:00",
            "source": "https://www.commanders.com/news/game-status-commanders-seahawks-week-3",
            "note": null
          },
          {
            "name": "rating",
            "status": "missing",
            "value": null,
            "observed_at": null,
            "source": null,
            "note": "独立の校正済み長期ratingは今回取得できず"
          }
        ],
        "data_confidence": "medium",
        "price_gap_factors": [
          "starting_qb_absence",
          "team_start_2_0_vs_0_2",
          "returning_seattle_qb"
        ],
        "disagreement_reasons": [
          "early_season_small_sample",
          "seattle_secondary_absences"
        ],
        "missing_information": [
          "calibrated_multi_season_independent_rating",
          "closing_price"
        ],
        "summary": "④は市場確率をbaseへコピーせず、①②③とも別の独立base78.2%から開始。当日欠場補正+2.3pt後のfinal80.5%。計算EVはプラスだが校正サンプル不足のためwatch。"
      },
      "settlement_override": null,
      "flags": [],
      "note": "④PRO EDGE独立186件走査。"
    }
  ]
}
