{
  "schema_version": 1,
  "meta": {
    "generated_by": "migration/migrate.js",
    "legacy_source": "analysis.html",
    "legacy_commit": "02e5167",
    "as_of": "2026-09-26T06:45:58+09:00",
    "status": "draft",
    "note": "④ PRO EDGE：新設の独立分析系統。旧RMCに対応するデータは無いため空。候補は④自身の探索回（pe-…）で独立に追加する。analysis.html は未切り替え。"
  },
  "system": "pro_edge",
  "discovery_runs": [],
  "picks": []
}
